"Agency type","Salutation","Client first name","Client last name","Email for client name","Phone","Title","PF membership level" 
Catholic Charities of Northeast Kansas,female,Michelle,Waltman,shelleyr21@sbcglobal.net,0,AP,AP - Standard, 
Catholic Community Services of Southern Arizona, Inc. ,male,Jerry,Twombly,twombly@carsoncomm.com,0,AP,AP - GOLD, 
Heart of Adoptions Inc.,male,James,Wiley,shannonwiley@earthlink.net,0,AP,AP - Standard, 
Catholic Charities Tennesse,female,Mandy,Quiram,arowland4@hotmail.com,0,AP,AP - Standard, 
Catholic Charities of Northeast Kansas,male,Derek,Teeter,derekandholly2011@gmail.com,0,AP,AP - Standard, 
