"Agency type","Salutation","Client first name","Client last name","Email for client name","Phone","Title","PF membership level" 
Catholic Charities Cleveland,male,Marty,OToole,xxnovak@yahoo.com,0,AP,AP - GOLD, 
Catholic Social Services Alaska,male,Riordan,Burch,michelle_ak_burch@yahoo.com,0,AP,AP - GOLD, 
Catholic Charities Cleveland,female,Patricia,Dolence,pfdole@gmail.com,0,AP,AP - GOLD, 
Catholic Charities La Crosse,female,Ami ,Fullwood,afullwood@centurytel.net,0,AP,AP - GOLD, 
Catholic Guardian Society and Home Bureau,male,James,Sullivan,nataliesullivan72@yahoo.com,0,AP,AP - GOLD, 
Catholic Charities La Crosse,male,Justin ,Paul,menicole23@hotmail.com,0,AP,AP - GOLD, 
Catholic Social Service,female,Marisa,Cannata,marisa.cannata@gmail.com,0,AP,AP - GOLD, 
Catholic Guardian Society and Home Bureau,male,Dan,Melore,dmelore@hotmail.com,0,AP,AP - GOLD, 
Catholic Community Services of Southern Arizona, Inc. ,female,Deanna,Mootz,deannacna@hotmail.com,0,AP,AP - Standard, 
